Title,Media URL,Pinterest board,Thumbnail,Description,Link,Publish date,Keywords
Step into Tradition: Chic Brown Kolhapuri Chappals for Women,https://styvorafashion.com/kolhapurichappalsforwomenethnicsandals/images/step-into-tradition-chic-brown-kolhapuri-chappals-for-women.jpg,Kolhapuri Chappals for Women | Ethnic Sandals,,"Elevate your everyday look with our exquisite brown Kolhapuri Chappals. These women's sandals blend traditional Indian craftsmanship with modern comfort, featuring a sleek design and ornate metallic accent. Perfect for festive occasions or daily elegance. Experience authentic style & lasting comfort. 

 #KolhapuriChappals #WomensFootwear #IndianFashion #EthnicSandals #BrownChappals #MadeInIndia",https://styvorafashion.com/kolhapurichappalsforwomenethnicsandals/step-into-tradition-chic-brown-kolhapuri-chappals-for-women.html,,Kolhapuri Chappals for Women | Ethnic Sandals
Chic Lavender Kolhapuri Chappals: Embellished Flats for Women,https://styvorafashion.com/kolhapurichappalsforwomenethnicsandals/images/chic-lavender-kolhapuri-chappals-embellished-flats-for-women.jpg,Kolhapuri Chappals for Women | Ethnic Sandals,,"Adorn your feet with our chic lavender Kolhapuri chappals for women. Featuring elegant gold-tone embellishments & a comfortable sole with delicate floral patterns, these stylish flats are perfect for everyday wear or festive occasions. Elevate your ethnic & casual Indian fashion effortlessly. Shop women's sandals in India. 

 #KolhapuriChappals #WomensFashion #IndianFootwear #LavenderSandals #EthnicChic #FlatsForWomen #FashionIndia",https://styvorafashion.com/kolhapurichappalsforwomenethnicsandals/chic-lavender-kolhapuri-chappals-embellished-flats-for-women.html,,Kolhapuri Chappals for Women | Ethnic Sandals
Vibrant Kolhapuri Chappals for Women: Ethnic Style & Comfort,https://styvorafashion.com/kolhapurichappalsforwomenethnicsandals/images/vibrant-kolhapuri-chappals-for-women-ethnic-style-comfort.jpg,Kolhapuri Chappals for Women | Ethnic Sandals,,"Step into tradition with our vibrant Kolhapuri Chappals for women. Featuring colorful woven straps & sparkling silver details, these handcrafted Indian sandals blend ethnic charm with modern comfort. Perfect footwear for daily elegance or festive occasions. Discover the latest styles in women's fashion footwear from India! 

 #KolhapuriChappals #WomensFootwear #IndianFashion #EthnicSandals #TraditionalFootwear #FashionIndia #Handcrafted",https://styvorafashion.com/kolhapurichappalsforwomenethnicsandals/vibrant-kolhapuri-chappals-for-women-ethnic-style-comfort.html,,Kolhapuri Chappals for Women | Ethnic Sandals
Elegant Kolhapuri Chappals for Women - Traditional & Chic,https://styvorafashion.com/kolhapurichappalsforwomenethnicsandals/images/elegant-kolhapuri-chappals-for-women-traditional-chic.jpg,Kolhapuri Chappals for Women | Ethnic Sandals,,"Step into grace with our exquisite Kolhapuri Chappals for women. These off-white sandals feature intricate silver-toned embroidery & subtle pink accents, perfect for elevating your ethnic and fusion wear. Experience comfort & style, a must-have in every Indian fashion wardrobe. Shop the latest collection of traditional women's footwear. 

 #KolhapuriChappals #WomensFootwear #IndianFashion #EthnicSandals #TraditionalChappals #Handcrafted #FashionIndia",https://styvorafashion.com/kolhapurichappalsforwomenethnicsandals/elegant-kolhapuri-chappals-for-women-traditional-chic.html,,Kolhapuri Chappals for Women | Ethnic Sandals
